{
  "schema": "blocksmith.lock.v1",
  "docRef": "upload:scan-acme-mobile-app.md",
  "systemId": "acme-mobile-app",
  "contentHash": "sha256:afffd0184ad0a9a1d184f247916216c1",
  "generatedAt": "2026-06-04T12:00:00.000Z",
  "blocks": {
    "agent-rule:cta-density": {
      "version": 2,
      "contentHash": "sha256:f230b745e69825d991b3eccceb716a53"
    },
    "component:button-primary": {
      "version": 4,
      "contentHash": "sha256:d9d425a1454f527affc7906305f0b32e"
    },
    "token:color:accent": {
      "version": 1,
      "contentHash": "sha256:a40ae6c94ffbaeff0ee94d459043a971"
    }
  },
  "package": {
    "name": "@blocksmith/acme-mobile-app"
  }
}
